{
  "blocked_by": [],
  "checkpoint": "CE-GALL-26",
  "command": "sh scripts/run-ferroplan-mcp.sh (from /tmp, all steering vars cleared)",
  "cwd": "/tmp",
  "date": "2026-07-29",
  "exit_code": 0,
  "git_revision": "e2e683d74ed26fcba3bdc671764a81d2862a090c",
  "known_anti_patterns": [
    "the /tmp handshake was run by hand once this session and is NOT a test; no automated regression covers the exact defect that was fixed"
  ],
  "negative_falsifier": {
    "file": "plugins/chatman-ecosystem/tests/test_roots.py",
    "result": "passed",
    "test": "test_unresolved_binary_is_never_rendered_as_a_shell_argv",
    "why_this_counts": "an unresolved binary rendered as the empty string would hand a launcher `exec \"\"`; it now refuses"
  },
  "positive_witness": {
    "file": "plugins/chatman-ecosystem/scripts/run-ferroplan-mcp.sh",
    "result": "serverInfo {\"name\":\"ferroplan\",\"version\":\"0.17.0\"}",
    "test": "MCP initialize handshake from /tmp",
    "why_this_counts": "previously exit 69 while a built binary sat in target/debug; the 4-parents-up walk was calibrated for the repo layout and wrong under the install layout"
  },
  "reason": "NO_FALSIFIER",
  "replay_host": null,
  "replayed_outside_session": false,
  "schema": "urn:chatman:gall-checkpoint-receipt:v1",
  "sealed_at_commit": null,
  "standing": "PARTIAL_ALIVE",
  "title": "Resolution from anywhere"
}
