{
  "blocked_by": [],
  "checkpoint": "CE-GALL-24",
  "command": "python3 scripts/generate.py build --check",
  "cwd": "plugins/chatman-ecosystem",
  "date": "2026-07-29",
  "exit_code": 0,
  "git_revision": "e2e683d74ed26fcba3bdc671764a81d2862a090c",
  "known_anti_patterns": [
    "6 of roughly 30 emitted payloads are registered; the coverage ratio is measured nowhere and is left UNKNOWN"
  ],
  "negative_falsifier": {
    "file": "plugins/chatman-ecosystem/tests/test_generated.py",
    "result": "passed",
    "test": "test_check_detects_a_tampered_projection",
    "why_this_counts": "proves generate.py build --check is not a no-op; verified by hand against a tampered schema, which exited 1"
  },
  "positive_witness": {
    "file": "plugins/chatman-ecosystem/tests/test_generated.py",
    "result": "passed",
    "test": "test_emitted_payload_validates_against_its_committed_schema",
    "why_this_counts": "what is emitted satisfies what is published, for every registered model"
  },
  "reason": null,
  "replay_host": "fresh `git clone` of origin (not this checkout) to an isolated scratch path, checked out at the sealed commit with a clean worktree, run in an isolated uv venv with CLAUDE_PLUGIN_ROOT/CLAUDE_PROJECT_DIR/CLAUDE_PLUGIN_DATA/FERROPLAN_ROOT/CARGO_TARGET_DIR unset, by a scheduled-routine session with no memory of authoring this receipt or its tests -- 2026-07-30",
  "replayed_outside_session": true,
  "schema": "urn:chatman:gall-checkpoint-receipt:v1",
  "sealed_at_commit": "e2e683d74ed26fcba3bdc671764a81d2862a090c",
  "standing": "ALIVE",
  "title": "Machine-first output contract"
}
