{
  "blocked_by": [],
  "checkpoint": "CE-GALL-25",
  "command": "python3 -m pytest tests/test_hookguard.py -q",
  "cwd": "plugins/chatman-ecosystem",
  "date": "2026-07-29",
  "exit_code": 0,
  "git_revision": "4126cc6e387d113b97a32394c295a2125653d254",
  "known_anti_patterns": [
    "no live Claude Code session has been observed honoring a hookguard refusal; runtime acceptance of the emitted shapes is UNKNOWN and is not fixable by more unit tests"
  ],
  "negative_falsifier": {
    "file": "plugins/chatman-ecosystem/tests/test_hookguard.py",
    "result": "passed",
    "test": "test_import_failure_produces_a_refusal",
    "why_this_counts": "a simulated ImportError yields a refusal shaped for the event, never a traceback and never a silent exit 0 on a deny path"
  },
  "positive_witness": {
    "file": "plugins/chatman-ecosystem/tests/test_hookguard.py",
    "result": "passed",
    "test": "test_guard_uses_only_the_standard_library",
    "why_this_counts": "the last line of defence cannot itself fail on the dependency it is guarding against"
  },
  "reason": null,
  "replay_host": "independent fresh git clone (separate .git/worktree from the authoring session) at commit 4126cc6e387d113b97a32394c295a2125653d254, all 5 steering vars (CLAUDE_PLUGIN_DATA, CLAUDE_PLUGIN_ROOT, CLAUDE_PROJECT_DIR, FERROPLAN_ROOT, CARGO_TARGET_DIR) unset, ruff/compileall/shell-syntax/generate.py build --check/pytest all green",
  "replayed_outside_session": true,
  "schema": "urn:chatman:gall-checkpoint-receipt:v1",
  "sealed_at_commit": "4126cc6e387d113b97a32394c295a2125653d254",
  "standing": "ALIVE",
  "title": "Fail-closed hook guard"
}
