{
  "blocked_by": [],
  "checkpoint": "CE-GALL-23",
  "command": "python3 -m pytest tests/test_phase_space.py -q",
  "cwd": "plugins/chatman-ecosystem",
  "date": "2026-07-29",
  "exit_code": 0,
  "git_revision": "e2e683d74ed26fcba3bdc671764a81d2862a090c",
  "known_anti_patterns": [
    "nothing external validates that the 136 lawful vectors are the *right* 136"
  ],
  "negative_falsifier": {
    "file": "plugins/chatman-ecosystem/tests/test_phase_space.py",
    "result": "passed",
    "test": "test_every_invariant_fires_at_least_once",
    "why_this_counts": "re-adding the deleted validated-plan-requires-candidate invariant (key requires_any_prior, never read by validate_vector) makes this fail. The lawful count staying at 136 after deletion is independent proof the invariant was inert"
  },
  "positive_witness": {
    "file": "plugins/chatman-ecosystem/tests/test_phase_space.py",
    "result": "passed",
    "test": "test_lawful_count_is_pinned",
    "why_this_counts": "648 raw / 136 lawful / exactly 1 publishable, all derived rather than asserted beside the invariants"
  },
  "reason": null,
  "replay_host": "fresh `git clone` of origin (not this checkout) to an isolated scratch path, checked out at the sealed commit with a clean worktree, run in an isolated uv venv with CLAUDE_PLUGIN_ROOT/CLAUDE_PROJECT_DIR/CLAUDE_PLUGIN_DATA/FERROPLAN_ROOT/CARGO_TARGET_DIR unset, by a scheduled-routine session with no memory of authoring this receipt or its tests -- 2026-07-30",
  "replayed_outside_session": true,
  "schema": "urn:chatman:gall-checkpoint-receipt:v1",
  "sealed_at_commit": "e2e683d74ed26fcba3bdc671764a81d2862a090c",
  "standing": "ALIVE",
  "title": "Derived combination census, inert invariant refused"
}
